{
  "schema": "cdeadmin.ui-options.v1",
  "engine": "mariadb",
  "dialect": {
    "column_types": [
      "TINYINT",
      "SMALLINT",
      "MEDIUMINT",
      "INT",
      "BIGINT",
      "DECIMAL",
      "FLOAT",
      "DOUBLE",
      "BIT",
      "BOOLEAN",
      "DATE",
      "DATETIME",
      "TIMESTAMP",
      "TIME",
      "YEAR",
      "CHAR",
      "VARCHAR",
      "BINARY",
      "VARBINARY",
      "TINYBLOB",
      "BLOB",
      "MEDIUMBLOB",
      "LONGBLOB",
      "TINYTEXT",
      "TEXT",
      "MEDIUMTEXT",
      "LONGTEXT",
      "ENUM",
      "SET",
      "JSON",
      "GEOMETRY",
      "POINT",
      "LINESTRING",
      "POLYGON",
      "MULTIPOINT",
      "MULTILINESTRING",
      "MULTIPOLYGON",
      "GEOMETRYCOLLECTION",
      "INET4",
      "INET6",
      "UUID"
    ],
    "index_methods": [
      "BTREE",
      "HASH",
      "FULLTEXT",
      "SPATIAL",
      "RTREE"
    ],
    "routine_languages": [
      "SQL"
    ],
    "privileges": {
      "table": [
        "SELECT",
        "INSERT",
        "UPDATE",
        "DELETE",
        "REFERENCES",
        "INDEX",
        "ALTER",
        "CREATE",
        "DROP",
        "TRIGGER",
        "SHOW VIEW",
        "CREATE VIEW"
      ],
      "view": [
        "SELECT",
        "INSERT",
        "UPDATE",
        "DELETE",
        "SHOW VIEW"
      ],
      "routine": [
        "EXECUTE",
        "ALTER ROUTINE"
      ],
      "procedure": [
        "EXECUTE",
        "ALTER ROUTINE"
      ],
      "function": [
        "EXECUTE",
        "ALTER ROUTINE"
      ],
      "database": [
        "SELECT",
        "INSERT",
        "UPDATE",
        "DELETE",
        "CREATE",
        "DROP",
        "REFERENCES",
        "INDEX",
        "ALTER",
        "CREATE TEMPORARY TABLES",
        "LOCK TABLES",
        "EXECUTE",
        "CREATE VIEW",
        "SHOW VIEW",
        "CREATE ROUTINE",
        "ALTER ROUTINE",
        "EVENT",
        "TRIGGER"
      ]
    },
    "trigger_events": {
      "table": [
        "INSERT",
        "UPDATE",
        "DELETE"
      ]
    },
    "system_privileges": [
      "ALL",
      "SUPER",
      "PROCESS",
      "RELOAD",
      "SHUTDOWN",
      "FILE",
      "SHOW DATABASES",
      "REPLICATION SLAVE",
      "REPLICATION CLIENT",
      "CREATE USER",
      "CREATE TABLESPACE",
      "EVENT",
      "TRIGGER",
      "BINLOG ADMIN",
      "BINLOG MONITOR",
      "BINLOG REPLAY",
      "CONNECTION ADMIN",
      "FEDERATED ADMIN",
      "READ_ONLY ADMIN",
      "REPLICATION MASTER ADMIN",
      "REPLICATION SLAVE ADMIN",
      "SET USER",
      "SLAVE MONITOR"
    ],
    "auth_plugins": [
      "mysql_native_password",
      "ed25519",
      "unix_socket",
      "pam",
      "gssapi",
      "parsec"
    ],
    "grantable_kinds": [
      "table",
      "view",
      "procedure",
      "function",
      "package",
      "database"
    ],
    "storage_engines": [
      "InnoDB",
      "Aria",
      "MyISAM",
      "MEMORY",
      "CSV",
      "ARCHIVE",
      "BLACKHOLE",
      "MRG_MyISAM",
      "FEDERATED",
      "CONNECT",
      "SEQUENCE",
      "Spider",
      "ColumnStore",
      "S3"
    ]
  },
  "catalog": {
    "tablespaces": {
      "resource_kind": "tablespace"
    },
    "databases": {
      "resource_kind": "database"
    },
    "tables": {
      "resource_kind": "table"
    },
    "character_sets": {
      "resource_kind": "character-set"
    },
    "collations": {
      "resource_kind": "collation"
    },
    "storage_engines": {
      "resource_kind": "storage-engine"
    },
    "users": {
      "resource_kind": "user"
    },
    "roles": {
      "resource_kind": "role"
    }
  },
  "notes": "Static dialect lists are drafts for the tested version; the engine stream verifies them against the dialect contract. catalog entries resolve at runtime from the endpoint's resources of the named kind."
}
