{"schema":"cdeadmin.ui-options.v1","engine":"mysql","dialect":{"column_types":["TINYINT","SMALLINT","MEDIUMINT","INT","BIGINT","DECIMAL","FLOAT","DOUBLE","BIT","BOOLEAN","DATE","DATETIME","TIMESTAMP","TIME","YEAR","CHAR","VARCHAR","BINARY","VARBINARY","TINYBLOB","BLOB","MEDIUMBLOB","LONGBLOB","TINYTEXT","TEXT","MEDIUMTEXT","LONGTEXT","ENUM","SET","JSON","GEOMETRY","POINT","LINESTRING","POLYGON","MULTIPOINT","MULTILINESTRING","MULTIPOLYGON","GEOMETRYCOLLECTION"],"index_methods":["BTREE","HASH","FULLTEXT","SPATIAL"],"routine_languages":["SQL"],"privileges":{"table":["SELECT","INSERT","UPDATE","DELETE","REFERENCES","INDEX","ALTER","CREATE","DROP","TRIGGER","SHOW VIEW","CREATE VIEW"],"view":["SELECT","INSERT","UPDATE","DELETE","SHOW VIEW"],"routine":["EXECUTE","ALTER ROUTINE"],"procedure":["EXECUTE","ALTER ROUTINE"],"function":["EXECUTE","ALTER ROUTINE"],"database":["SELECT","INSERT","UPDATE","DELETE","CREATE","DROP","REFERENCES","INDEX","ALTER","CREATE TEMPORARY TABLES","LOCK TABLES","EXECUTE","CREATE VIEW","SHOW VIEW","CREATE ROUTINE","ALTER ROUTINE","EVENT","TRIGGER"]},"trigger_events":{"table":["INSERT","UPDATE","DELETE"]},"system_privileges":["ALL","SUPER","PROCESS","RELOAD","SHUTDOWN","FILE","SHOW DATABASES","REPLICATION SLAVE","REPLICATION CLIENT","CREATE USER","CREATE ROLE","DROP ROLE","CREATE TABLESPACE","EVENT","TRIGGER","BACKUP_ADMIN","BINLOG_ADMIN","CONNECTION_ADMIN","ROLE_ADMIN","SYSTEM_VARIABLES_ADMIN","XA_RECOVER_ADMIN"],"auth_plugins":["caching_sha2_password","mysql_native_password","sha256_password","auth_socket"],"grantable_kinds":["table","view","procedure","function","database"],"storage_engines":["InnoDB","MyISAM","MEMORY","CSV","ARCHIVE","BLACKHOLE","MRG_MYISAM","FEDERATED","NDB"]},"catalog":{"tablespaces":{"resource_kind":"tablespace"},"databases":{"resource_kind":"database"},"tables":{"resource_kind":"table"},"character_sets":{"resource_kind":"character-set"},"collations":{"resource_kind":"collation"},"storage_engines":{"resource_kind":"storage-engine"},"users":{"resource_kind":"user"},"roles":{"resource_kind":"role"}},"notes":"Static dialect lists are drafts for the tested version; the engine stream verifies them against the dialect contract. catalog entries resolve at runtime from the endpoint's resources of the named kind."}
